{
    "api_gateway": {
        "cloudwatch_metrics_enabled": false,
        "data_trace_enabled": false,
        "endpoint_type": "PRIVATE",
        "key_enabled": true,
        "name": null,
        "stage_name": null,
        "usage_plan_burst_limit": 10000,
        "usage_plan_rate_limit": 5000,
        "xray_tracing_enabled": false
    },
    "api_gateway_swagger_variables": null,
    "cloudfront_distribution": {
        "acm_certificate_arn": null,
        "alias": null,
        "default_root_object": "index.html",
        "geo_restriction_locations": [],
        "geo_restriction_type": "none",
        "is_enabled": true,
        "is_ipv6_enabled": false,
        "logging_include_cookies": false,
        "logging_prefix": null,
        "name": null,
        "price_class": "PriceClass_200"
    },
    "cloudfront_distribution_default_cache_behavior": null,
    "cloudfront_distribution_ordered_cache_behaviors": null,
    "cloudfront_distribution_origins": null,
    "cloudfront_distribution_s3_origins": null,
    "cloudfront_enabled": false,
    "cloudfront_origin_access_identity_name": null,
    "environment_type": null,
    "lambda_function": {
        "canary_enabled": false,
        "description": null,
        "environment_variables": {
            "first": "value",
            "second": "value"
        },
        "execution_role_arn": null,
        "handler": null,
        "memory_size": 1024,
        "name": null,
        "permission_paths": [],
        "runtime": null,
        "timeout": 300,
        "tracing_config_mode": "Active"
    },
    "lambda_function_brands": [
        "hsbc"
    ],
    "logging_bucket_name": null,
    "region": null,
    "s3_bucket": {
        "acl": "private",
        "force_destroy": false,
        "name": null,
        "tags": {},
        "versioning_enabled": true
    },
    "terraform_state_bucket_name": null,
    "waf_enabled": true,
    "waf_web_acl_arn": null,
    "web_acl_id": null
}